{
  "id": "legacy-and-platform-re-engineering",
  "title": "Legacy and platform re-engineering",
  "kind": "curated",
  "description": "Recipes for moving existing SQL, notebooks, connectors and estates onto dbt, dlt and Fabric, from assessing what a move would take to converting each piece.",
  "members": [
    "adf-mapping-data-flow-to-dlt-dbt",
    "assess-synapse-ssis-for-fabric",
    "legacy-sql-to-dbt",
    "managed-connector-to-dlt",
    "materialized-view-to-dbt",
    "notebook-transformation-to-dbt",
    "scalar-sql-function-to-dbt-macro",
    "spark-ingestion-notebook-to-dlt",
    "stored-procedure-to-dbt",
    "scd-procedure-to-dbt-snapshot",
    "move-dbt-project-destination"
  ]
}
