{
  "id": "ingestion-and-reconciliation",
  "title": "Ingest and reconcile source data",
  "kind": "problem-area",
  "description": "Recipes for landing source data in owned pipelines and governed tables, with explicit record disposition, safe reruns and reconciliation.",
  "members": [
    "adf-mapping-data-flow-to-dlt-dbt",
    "api-to-bronze-incremental-contract",
    "batch-cdc-current-state",
    "cross-platform-live-reconciliation",
    "database-tables-to-bronze",
    "file-drop-to-bronze",
    "governed-spreadsheet-table",
    "managed-connector-to-dlt",
    "spark-ingestion-notebook-to-dlt",
    "ssis-package-to-versioned-pipeline",
    "telecom-cdr-usage",
    "visual-etl-mapping-to-dlt-dbt"
  ]
}
