{
  "id": "semantic-layers",
  "title": "Semantic layers",
  "kind": "problem-area",
  "description": "Recipes for defining governed metrics and semantic models that downstream tools query.",
  "members": [
    "bi-calculations-to-governed-metrics",
    "metricflow-semantic-model",
    "fabric-direct-lake-semantic-model"
  ]
}
