{
  "id": "customer-and-product-analytics",
  "title": "Customer and product analytics",
  "kind": "curated",
  "description": "Recipes for building customer value, retention, segmentation and product behaviour models that business teams can reproduce.",
  "members": [
    "customer-rfm-segmentation",
    "customer-historical-ltv"
  ]
}
