{
  "id": "modelling-correctness",
  "title": "Build models that answer the right questions",
  "kind": "curated",
  "description": "Recipes for building analytical models with explicit grain, populations, relationships, history, operational time and business rules.",
  "members": [
    "business-event-fact",
    "metric-population-and-rollups",
    "event-resource-attribution",
    "dbt-snapshot-history",
    "operational-state-duration",
    "product-sessionization-funnels",
    "logistics-fleet-utilization",
    "shift-unit-economics",
    "effective-dated-business-rules",
    "prove-dbt-change-safe",
    "customer-rfm-segmentation",
    "customer-historical-ltv",
    "customer-retention-churn-features",
    "customer-consent-preferences",
    "marketing-attribution-models",
    "banking-aml-features",
    "shared-calendar-fiscal-periods",
    "shared-fx-conversion",
    "retail-sell-through-stockout",
    "insurance-loss-triangles",
    "healthcare-readmission-cohort",
    "healthcare-claims-remittance",
    "banking-delinquency-vintages"
  ]
}
